#
# 1. Create source-replica topology
include/rpl/init_source_replica.inc
Warnings:
Note	####	Sending passwords in plain text without SSL/TLS is extremely insecure.
Note	####	Storing MySQL user name or password information in the connection metadata repository is not secure and is therefore not recommended. Please consider using the USER and PASSWORD connection options for START REPLICA; see the 'START REPLICA Syntax' in the MySQL Manual for more information.
[connection master]
#
# 2. For each Scenario [Table with index, Table with out index]
#
# 2.1 On the source, create a table and insert two rows with
#     the same hash value
[connection master]
CREATE TABLE t1 (
a BIGINT UNSIGNED NOT NULL,
b BIGINT UNSIGNED NOT NULL,
c INT DEFAULT NULL,
KEY idx (c)
) ENGINE= InnoDB ;
INSERT INTO t1 VALUES(0xa8e8ee744ced7ca8, 0x6850119e455ee4ed, null);
INSERT INTO t1 VALUES(0x135cd25c170db910, 0x6916c5057592c796, null);
include/rpl/sync_to_replica.inc
[connection master]
#
# 2.2 On the source, perform an update on the second row
#     and verify that the update is successful
UPDATE t1 SET b=1 WHERE a=0x135cd25c170db910;
SELECT * FROM t1;
a	b	c
12171240176243014824	7516527149547709677	NULL
1395221277543610640	1	NULL
#
# 2.3 Verify that the update is successful on the replica
include/rpl/sync_to_replica.inc
include/diff_tables.inc [master:test.t1, slave:test.t1]
[connection master]
DROP TABLE t1;
include/rpl/sync_to_replica.inc
#
# 2.1 On the source, create a table and insert two rows with
#     the same hash value
[connection master]
CREATE TABLE t1 (
a BIGINT UNSIGNED NOT NULL,
b BIGINT UNSIGNED NOT NULL,
c INT DEFAULT NULL
) ENGINE= InnoDB ;
INSERT INTO t1 VALUES(0xa8e8ee744ced7ca8, 0x6850119e455ee4ed, null);
INSERT INTO t1 VALUES(0x135cd25c170db910, 0x6916c5057592c796, null);
include/rpl/sync_to_replica.inc
[connection master]
#
# 2.2 On the source, perform an update on the second row
#     and verify that the update is successful
UPDATE t1 SET b=1 WHERE a=0x135cd25c170db910;
SELECT * FROM t1;
a	b	c
12171240176243014824	7516527149547709677	NULL
1395221277543610640	1	NULL
#
# 2.3 Verify that the update is successful on the replica
include/rpl/sync_to_replica.inc
include/diff_tables.inc [master:test.t1, slave:test.t1]
[connection master]
DROP TABLE t1;
include/rpl/sync_to_replica.inc
#
# 3. Cleanup
include/rpl/deinit.inc
