create table opening_lines (
id INT UNSIGNED AUTO_INCREMENT NOT NULL PRIMARY KEY,
opening_line TEXT(500),
author VARCHAR(200),
title VARCHAR(200),
FULLTEXT idx (opening_line)
) ENGINE=InnoDB;
insert into opening_lines(opening_line,author,title) VALUES
('A screaming comes across the sky.','Thomas Pynchon','Gravity\'s Rainbow');
select * from opening_lines WHERE MATCH(opening_line) AGAINST('screaming');
id	opening_line	author	title
1	A screaming comes across the sky.	Thomas Pynchon	Gravity's Rainbow
set debug='+d,fts_sync_cache_and_crash_after_commit_table';
delete from opening_lines;
ERROR HY000: Lost connection to MySQL server during query
# Restart the master server
select * from opening_lines;
id	opening_line	author	title
1	A screaming comes across the sky.	Thomas Pynchon	Gravity's Rainbow
select * from opening_lines WHERE MATCH(opening_line) AGAINST('screaming');
id	opening_line	author	title
1	A screaming comes across the sky.	Thomas Pynchon	Gravity's Rainbow
drop table opening_lines;
